{
  "schemaVersion": 1,
  "id": "ev-3-2",
  "episodeID": "episode-3",
  "mediaVersionID": "media-3",
  "transcriptRevisionID": "transcript-3",
  "segmentIDs": [
    "seg-3-2"
  ],
  "excerpt": "Die Architekturentscheidung haengt von der konkreten Ausfallsituation ab.",
  "range": {
    "startMs": 50000,
    "endMs": 66000
  },
  "timingStatus": "verified",
  "accessRevision": 1
}
