{
  "schemaVersion": 1,
  "id": "ev-1-0",
  "episodeID": "episode-1",
  "mediaVersionID": "media-1",
  "transcriptRevisionID": "transcript-1",
  "segmentIDs": [
    "seg-1-0"
  ],
  "excerpt": "Ein lokales Modell kann Anfragen ohne externen Modellanbieter verarbeiten.",
  "range": {
    "startMs": 10000,
    "endMs": 26000
  },
  "timingStatus": "verified",
  "accessRevision": 1
}
