{
  "schemaVersion": 1,
  "id": "ev-2-0",
  "episodeID": "episode-2",
  "mediaVersionID": "media-2",
  "transcriptRevisionID": "transcript-2",
  "segmentIDs": [
    "seg-2-0"
  ],
  "excerpt": "Ein verwalteter Cloud-Dienst kann den eigenen Betriebsaufwand fuer ein Modell verringern.",
  "range": {
    "startMs": 10000,
    "endMs": 26000
  },
  "timingStatus": "verified",
  "accessRevision": 1
}
