{
  "schemaVersion": 1,
  "id": "ev-4-1",
  "episodeID": "episode-4",
  "mediaVersionID": "media-4",
  "transcriptRevisionID": "transcript-4",
  "segmentIDs": [
    "seg-4-1"
  ],
  "excerpt": "Die Schnittstellen und die Zustandsuebernahme brauchen dann eigene Tests.",
  "range": {
    "startMs": 30000,
    "endMs": 46000
  },
  "timingStatus": "verified",
  "accessRevision": 1
}
