{
  "schemaVersion": 1,
  "id": "ev-1-2",
  "episodeID": "episode-1",
  "mediaVersionID": "media-1",
  "transcriptRevisionID": "transcript-1",
  "segmentIDs": [
    "seg-1-2"
  ],
  "excerpt": "Diese Einschätzung ist kein allgemeines Kostenversprechen.",
  "range": {
    "startMs": 50000,
    "endMs": 66000
  },
  "timingStatus": "verified",
  "accessRevision": 1
}
