{
  "schemaVersion": 1,
  "id": "ev-4-0",
  "episodeID": "episode-4",
  "mediaVersionID": "media-4",
  "transcriptRevisionID": "transcript-4",
  "segmentIDs": [
    "seg-4-0"
  ],
  "excerpt": "Eine hybride Architektur kann lokale Grundfunktionen und verwaltete Zusatzfunktionen trennen.",
  "range": {
    "startMs": 10000,
    "endMs": 26000
  },
  "timingStatus": "verified",
  "accessRevision": 1
}
