{
  "schemaVersion": 1,
  "id": "ev-1-1",
  "episodeID": "episode-1",
  "mediaVersionID": "media-1",
  "transcriptRevisionID": "transcript-1",
  "segmentIDs": [
    "seg-1-1"
  ],
  "excerpt": "Der Betriebsaufwand bleibt eine eigene Aufgabe.",
  "range": {
    "startMs": 30000,
    "endMs": 46000
  },
  "timingStatus": "verified",
  "accessRevision": 1
}
